{
  "$schema": "./schemas/qa-manifest.schema.json",
  "version": "1.5.0",
  "baseline": {
    "commit": "2d85d25e66341bdbf0bbb0b50aa3ea94cf51abaf",
    "updatedAt": "2026-10-24T08:27:18.588Z"
  },
  "lastVerifiedCommit": "2d85d25e66341bdbf0bbb0b50aa3ea94cf51abaf",
  "projectConfig": {
    "angularRoot": "src/app",
    "openApiSchemaPath": "openapi.json",
    "supportedLocales": [
      "en-US"
    ],
    "routerMode": "hash",
    "roles": [
      "user"
    ],
    "viewports": [
      {
        "name": "desktop",
        "width": 1440,
        "height": 900
      },
      {
        "name": "tablet",
        "width": 768,
        "height": 1024
      },
      {
        "name": "mobile",
        "width": 390,
        "height": 844
      }
    ]
  },
  "services": {
    "translation": {
      "filePath": "src/app/services/translation.service.ts",
      "specPath": "src/app/services/translation.service.spec.ts",
      "className": "TranslationService",
      "specStatus": "TRIAGED",
      "specMetrics": {
        "tests": 14,
        "meaningfulAssertions": 40,
        "trivialAssertions": 0,
        "scaffoldMarker": false
      },
      "httpEndpoints": [
        {
          "openApiOperationId": "UNMAPPED",
          "contractVerified": true,
          "method": "GET",
          "urlPattern": "`i18n/${lang}.json`"
        }
      ],
      "dependents": [
        "src/app/contact/contact.component.ts",
        "src/app/cv/cv.component.ts",
        "src/app/experience/experience.component.ts",
        "src/app/expertise/expertise.component.ts",
        "src/app/header/header.component.ts",
        "src/app/hero/hero.component.ts",
        "src/app/publications/publications.component.ts",
        "src/app/skills/skills.component.ts"
      ],
      "ambiguitiesOrSuspectedBugs": [
        {
          "id": "VS-B3-translation",
          "description": "FIXED 2026-10-24: setLanguage() set currentLang and persisted the choice before the dictionary loaded, so a failed download showed \"中文\" over English content and remembered zh. Now commits only on success. Covered by translation.service.spec + home E2E \"[Degraded]\" test.",
          "resolution": "CONFIRMED_BUG"
        },
        {
          "id": "VS-FALLBACK-translation",
          "description": "FIXED 2026-10-24: enFallback had drifted from en.json (hero.subtitle, experience.list[0].tech missing LangChain). Synced; the spec now asserts the fallback deep-equals en.json.",
          "resolution": "CONFIRMED_BUG"
        }
      ],
      "lastContentHash": "96ec217031ea"
    }
  },
  "components": {
    "app": {
      "filePath": "src/app/app.component.ts",
      "templatePath": "src/app/app.component.html",
      "specPath": "src/app/app.component.spec.ts",
      "selector": "app-root",
      "className": "AppComponent",
      "importedTypes": [
        "RouterOutlet"
      ],
      "isStandalone": true,
      "isInlineTemplate": false,
      "specStatus": "VERIFIED",
      "specMetrics": {
        "tests": 4,
        "meaningfulAssertions": 6,
        "trivialAssertions": 0,
        "scaffoldMarker": false
      },
      "detectedFeatures": {
        "inputs": [],
        "outputs": [],
        "models": [],
        "templateBranches": 0,
        "interactiveEvents": [],
        "reactiveForms": [],
        "i18nKeys": [],
        "rbacDirectives": [],
        "rxJsSubscriptions": 0
      },
      "dimensionsVerified": {
        "functionalAndEdgeCases": true,
        "errorAndDegradedStates": true,
        "rbac": true,
        "a11y": true,
        "i18n": true,
        "memoryLeakUnsubscribe": true
      },
      "ambiguitiesOrSuspectedBugs": [],
      "lastContentHash": "724f276690cc"
    },
    "contact": {
      "filePath": "src/app/contact/contact.component.ts",
      "templatePath": "src/app/contact/contact.component.html",
      "specPath": "src/app/contact/contact.component.spec.ts",
      "selector": "app-contact",
      "className": "ContactComponent",
      "importedTypes": [],
      "isStandalone": true,
      "isInlineTemplate": false,
      "specStatus": "TRIAGED",
      "specMetrics": {
        "tests": 6,
        "meaningfulAssertions": 13,
        "trivialAssertions": 0,
        "scaffoldMarker": false
      },
      "detectedFeatures": {
        "inputs": [],
        "outputs": [],
        "models": [],
        "templateBranches": 0,
        "interactiveEvents": [],
        "reactiveForms": [],
        "i18nKeys": [],
        "rbacDirectives": [],
        "rxJsSubscriptions": 0
      },
      "dimensionsVerified": {
        "functionalAndEdgeCases": true,
        "errorAndDegradedStates": true,
        "rbac": true,
        "a11y": true,
        "i18n": true,
        "memoryLeakUnsubscribe": true
      },
      "ambiguitiesOrSuspectedBugs": [
        {
          "id": "VS-B1-contact",
          "description": "FIXED 2026-10-24: reference job titles and university were hard-coded Chinese/English strings, so the Malay locale showed Chinese text. Now contact.refSeniorEngineer/refProfessor/refUtar in all 3 dictionaries. Covered by contact.component.spec + home E2E \"[ms]\" test.",
          "resolution": "CONFIRMED_BUG"
        }
      ],
      "lastContentHash": "5754bc7ef521"
    },
    "cv": {
      "filePath": "src/app/cv/cv.component.ts",
      "templatePath": "src/app/cv/cv.component.html",
      "specPath": "src/app/cv/cv.component.spec.ts",
      "selector": "app-cv",
      "className": "CvComponent",
      "importedTypes": [],
      "isStandalone": true,
      "isInlineTemplate": false,
      "specStatus": "TRIAGED",
      "specMetrics": {
        "tests": 18,
        "meaningfulAssertions": 65,
        "trivialAssertions": 0,
        "scaffoldMarker": false
      },
      "detectedFeatures": {
        "inputs": [],
        "outputs": [],
        "models": [],
        "templateBranches": 13,
        "interactiveEvents": [
          "click"
        ],
        "reactiveForms": [],
        "i18nKeys": [],
        "rbacDirectives": [],
        "rxJsSubscriptions": 1
      },
      "dimensionsVerified": {
        "functionalAndEdgeCases": true,
        "errorAndDegradedStates": true,
        "rbac": true,
        "a11y": true,
        "i18n": true,
        "memoryLeakUnsubscribe": true
      },
      "ambiguitiesOrSuspectedBugs": [
        {
          "id": "VS-B2-cv",
          "description": "FIXED 2026-10-24: in the zoneless app, isGenerating was a plain field, so the Download PDF button stayed \"Generating PDF...\" and disabled after the download. Now a signal reset in try/finally (also on failure). Covered by cv.component.spec + CV E2E step 5.",
          "resolution": "CONFIRMED_BUG"
        },
        {
          "id": "VS-B4-cv",
          "description": "FIXED 2026-10-24: the header link opens /cv?lang=<current> but CvComponent ignored ?lang=, so the CV used the remembered language instead. Now applies supported values from queryParamMap (takeUntilDestroyed). Covered by cv.component.spec + CV E2E deep-link tests.",
          "resolution": "CONFIRMED_BUG"
        },
        {
          "id": "VS-NG0956-cv",
          "description": "FIXED 2026-10-24: bullet lists tracked by their translated text, so every language switch rebuilt all <li> nodes (NG0956 in dev). Now track $index.",
          "resolution": "CONFIRMED_BUG"
        }
      ],
      "lastContentHash": "4cda3d82bc18"
    },
    "experience": {
      "filePath": "src/app/experience/experience.component.ts",
      "templatePath": "src/app/experience/experience.component.html",
      "specPath": "src/app/experience/experience.component.spec.ts",
      "selector": "app-experience",
      "className": "ExperienceComponent",
      "importedTypes": [],
      "isStandalone": true,
      "isInlineTemplate": false,
      "specStatus": "TRIAGED",
      "specMetrics": {
        "tests": 13,
        "meaningfulAssertions": 29,
        "trivialAssertions": 0,
        "scaffoldMarker": false
      },
      "detectedFeatures": {
        "inputs": [],
        "outputs": [],
        "models": [],
        "templateBranches": 4,
        "interactiveEvents": [
          "click",
          "keydown.enter",
          "keydown.space"
        ],
        "reactiveForms": [],
        "i18nKeys": [],
        "rbacDirectives": [],
        "rxJsSubscriptions": 0
      },
      "dimensionsVerified": {
        "functionalAndEdgeCases": true,
        "errorAndDegradedStates": true,
        "rbac": true,
        "a11y": true,
        "i18n": true,
        "memoryLeakUnsubscribe": true
      },
      "ambiguitiesOrSuspectedBugs": [
        {
          "id": "VS-B5-experience",
          "description": "FIXED 2026-10-24: role=\"button\" card headers had no aria-expanded and ignored the Space key. Added [attr.aria-expanded] and (keydown.space). Covered by experience.component.spec + home E2E step 5.",
          "resolution": "CONFIRMED_BUG"
        }
      ],
      "lastContentHash": "61269df7804c"
    },
    "expertise": {
      "filePath": "src/app/expertise/expertise.component.ts",
      "templatePath": "src/app/expertise/expertise.component.html",
      "specPath": "src/app/expertise/expertise.component.spec.ts",
      "selector": "app-expertise",
      "className": "ExpertiseComponent",
      "importedTypes": [],
      "isStandalone": true,
      "isInlineTemplate": false,
      "specStatus": "TRIAGED",
      "specMetrics": {
        "tests": 10,
        "meaningfulAssertions": 34,
        "trivialAssertions": 0,
        "scaffoldMarker": false
      },
      "detectedFeatures": {
        "inputs": [],
        "outputs": [],
        "models": [],
        "templateBranches": 5,
        "interactiveEvents": [
          "click"
        ],
        "reactiveForms": [],
        "i18nKeys": [],
        "rbacDirectives": [],
        "rxJsSubscriptions": 0
      },
      "dimensionsVerified": {
        "functionalAndEdgeCases": true,
        "errorAndDegradedStates": true,
        "rbac": true,